A2: Experience
A3: The Table shows experience points needed to move from level to level. The formulae is New Level to the 4th power - Old Level to the 4th power. Negs are a percentage of total experience. 1 Neg = 1%% of total exp per Ishtar. 1 lolly lick = 1/750 of a level with a min of 5 exp points. ( values are rounded ) 1 lolly = 8/750 = 1.066% of a level at level 10 or above ( values are rounded ) Table below is being rebuilt!!!!! If the table below does not display properly click the refresh button
A5: Last Edited Monday, December 07, 2009 08:21:06 PM

A0: From Lvl # | B0: To Lvl # | C0: Exp Points Needed | D0: Total Exp | E0: Points = 1 Neg | F0: 1 Lolly Lick | G0: 1 Lolly
H1: 1 | I1: 2 | J1: =(B2^4)-(A2^4) -> 15 | K1: =(B2^4) -> 16 | L1: =((B2^4)-(A2^4))/100 -> 0.15 | M1: =((B2^4)-(A2^4))/2 -> 7.5 | N1: =((B2^4)-(A2^4))/2 -> 7.5
A2: 1 | B2: 2 | C2: =(B3^4)-(A3^4) -> 15 | D2: =(B3^4) -> 16 | E2: =((B3^4)-(A3^4))/100 -> 0.65 | F2: =((B3^4)-(A3^4))/2 -> 32.5 | G2: =((B3^4)-(A3^4))/2 -> 32.5
A3: 2 | B3: 3 | C3: =(B3^4)-(A3^4) -> 65 | D3: =(B3^4) -> 81 | E3: =((B3^4)-(A3^4))/100 -> 0.65 | F3: =((B3^4)-(A3^4))/2 -> 32.5 | G3: =((B3^4)-(A3^4))/2 -> 32.5
A4: 3 | B4: 4 | C4: =(B4^4)-(A4^4) -> 175 | D4: =(B4^4) -> 256 | E4: =((B4^4)-(A4^4))/100 -> 1.75 | F4: =((B4^4)-(A4^4))/2 -> 87.5 | G4: =((B4^4)-(A4^4))/2 -> 87.5
A5: 4 | B5: 5 | C5: =(B5^4)-(A5^4) -> 369 | D5: =(B5^4) -> 625 | E5: =((B5^4)-(A5^4))/100 -> 3.69 | F5: =((B5^4)-(A5^4))/2 -> 184.5 | G5: =((B5^4)-(A5^4))/2 -> 184.5
A6: 5 | B6: 6 | C6: =(B6^4)-(A6^4) -> 671 | D6: =(B6^4) -> 1296 | E6: =((B6^4)-(A6^4))/100 -> 6.71 | F6: =((B6^4)-(A6^4))/2 -> 335.5 | G6: =((B6^4)-(A6^4))/2 -> 335.5
A7: 6 | B7: 7 | C7: =(B7^4)-(A7^4) -> 1105 | D7: =(B7^4) -> 2401 | E7: =((B7^4)-(A7^4))/100 -> 11.05 | F7: =((B7^4)-(A7^4))/2 -> 552.5 | G7: =((B7^4)-(A7^4))/2 -> 552.5
A8: 7 | B8: 8 | C8: =(B8^4)-(A8^4) -> 1695 | D8: =(B8^4) -> 4096 | E8: =((B8^4)-(A8^4))/100 -> 16.95 | F8: =((B8^4)-(A8^4))/2 -> 847.5 | G8: =((B8^4)-(A8^4))/2 -> 847.5
A9: 8 | B9: 9 | C9: =(B9^4)-(A9^4) -> 2465 | D9: =(B9^4) -> 6561 | E9: =((B9^4)-(A9^4))/100 -> 24.65 | F9: =((B9^4)-(A9^4))/2 -> 1232.5 | G9: =((B9^4)-(A9^4))/2 -> 1232.5
A10: 9 | B10: 10 | C10: =(B10^4)-(A10^4) -> 3439 | D10: =(B10^4) -> 10000 | E10: =((B10^4)-(A10^4))/100 -> 34.39 | F10: =((B10^4)-(A10^4))/2 -> 1719.5 | G10: =((B10^4)-(A10^4))/2 -> 1719.5
A11: 10 | B11: 11 | C11: =(B11^4)-(A11^4) -> 4641 | D11: =(B11^4) -> 14641 | E11: =((B11^4)-(A11^4))/100 -> 46.41 | F11: =((B11^4)-(A11^4))/2 -> 2320.5 | G11: =((B11^4)-(A11^4))/2 -> 2320.5
A12: 11 | B12: 12 | C12: =(B12^4)-(A12^4) -> 6095 | D12: =(B12^4) -> 20736 | E12: =((B12^4)-(A12^4))/100 -> 60.95 | F12: =((B12^4)-(A12^4))/2 -> 3047.5 | G12: =((B12^4)-(A12^4))/2 -> 3047.5
A13: 12 | B13: 13 | C13: =(B13^4)-(A13^4) -> 7825 | D13: =(B13^4) -> 28561 | E13: =((B13^4)-(A13^4))/100 -> 78.25 | F13: =((B13^4)-(A13^4))/2 -> 3912.5 | G13: =((B13^4)-(A13^4))/2 -> 3912.5
A14: 13 | B14: 14 | C14: =(B14^4)-(A14^4) -> 9855 | D14: =(B14^4) -> 38416 | E14: =((B14^4)-(A14^4))/100 -> 98.55 | F14: =((B14^4)-(A14^4))/2 -> 4927.5 | G14: =((B14^4)-(A14^4))/2 -> 4927.5
A15: 14 | B15: 15 | C15: =(B15^4)-(A15^4) -> 12209 | D15: =(B15^4) -> 50625 | E15: =((B15^4)-(A15^4))/100 -> 122.09 | F15: =((B15^4)-(A15^4))/2 -> 6104.5 | G15: =((B15^4)-(A15^4))/2 -> 6104.5
A16: 15 | B16: 16 | C16: =(B16^4)-(A16^4) -> 14911 | D16: =(B16^4) -> 65536 | E16: =((B16^4)-(A16^4))/100 -> 149.11 | F16: =((B16^4)-(A16^4))/2 -> 7455.5 | G16: =((B16^4)-(A16^4))/2 -> 7455.5
A17: 16 | B17: 17 | C17: =(B17^4)-(A17^4) -> 17985 | D17: =(B17^4) -> 83521 | E17: =((B17^4)-(A17^4))/100 -> 179.85 | F17: =((B17^4)-(A17^4))/2 -> 8992.5 | G17: =((B17^4)-(A17^4))/2 -> 8992.5
A18: 17 | B18: 18 | C18: =(B18^4)-(A18^4) -> 21455 | D18: =(B18^4) -> 104976 | E18: =((B18^4)-(A18^4))/100 -> 214.55 | F18: =((B18^4)-(A18^4))/2 -> 10727.5 | G18: =((B18^4)-(A18^4))/2 -> 10727.5
A19: 18 | B19: 19 | C19: =(B19^4)-(A19^4) -> 25345 | D19: =(B19^4) -> 130321 | E19: =((B19^4)-(A19^4))/100 -> 253.45 | F19: =((B19^4)-(A19^4))/2 -> 12672.5 | G19: =((B19^4)-(A19^4))/2 -> 12672.5
A20: 19 | B20: 20 | C20: =(B20^4)-(A20^4) -> 29679 | D20: =(B20^4) -> 160000 | E20: =((B20^4)-(A20^4))/100 -> 296.79 | F20: =((B20^4)-(A20^4))/2 -> 14839.5 | G20: =((B20^4)-(A20^4))/2 -> 14839.5
A21: 20 | B21: 21 | C21: =(B21^4)-(A21^4) -> 34481 | D21: =(B21^4) -> 194481 | E21: =((B21^4)-(A21^4))/100 -> 344.81 | F21: =((B21^4)-(A21^4))/2 -> 17240.5 | G21: =((B21^4)-(A21^4))/2 -> 17240.5
A22: 21 | B22: 22 | C22: =(B22^4)-(A22^4) -> 39775 | D22: =(B22^4) -> 234256 | E22: =((B22^4)-(A22^4))/100 -> 397.75 | F22: =((B22^4)-(A22^4))/2 -> 19887.5 | G22: =((B22^4)-(A22^4))/2 -> 19887.5
A23: 22 | B23: 23 | C23: =(B23^4)-(A23^4) -> 45585 | D23: =(B23^4) -> 279841 | E23: =((B23^4)-(A23^4))/100 -> 455.85 | F23: =((B23^4)-(A23^4))/2 -> 22792.5 | G23: =((B23^4)-(A23^4))/2 -> 22792.5
A24: 23 | B24: 24 | C24: =(B24^4)-(A24^4) -> 51935 | D24: =(B24^4) -> 331776 | E24: =((B24^4)-(A24^4))/100 -> 519.35 | F24: =((B24^4)-(A24^4))/2 -> 25967.5 | G24: =((B24^4)-(A24^4))/2 -> 25967.5
A25: 24 | B25: 25 | C25: =(B25^4)-(A25^4) -> 58849 | D25: =(B25^4) -> 390625 | E25: =((B25^4)-(A25^4))/100 -> 588.49 | F25: =((B25^4)-(A25^4))/2 -> 29424.5 | G25: =((B25^4)-(A25^4))/2 -> 29424.5
A26: 25 | B26: 26 | C26: =(B26^4)-(A26^4) -> 66351 | D26: =(B26^4) -> 456976 | E26: =((B26^4)-(A26^4))/100 -> 663.51 | F26: =((B26^4)-(A26^4))/2 -> 33175.5 | G26: =((B26^4)-(A26^4))/2 -> 33175.5
A27: 26 | B27: 27 | C27: =(B27^4)-(A27^4) -> 74465 | D27: =(B27^4) -> 531441 | E27: =((B27^4)-(A27^4))/100 -> 744.65 | F27: =((B27^4)-(A27^4))/2 -> 37232.5 | G27: =((B27^4)-(A27^4))/2 -> 37232.5
A28: 27 | B28: 28 | C28: =(B28^4)-(A28^4) -> 83215 | D28: =(B28^4) -> 614656 | E28: =((B28^4)-(A28^4))/100 -> 832.15 | F28: =((B28^4)-(A28^4))/2 -> 41607.5 | G28: =((B28^4)-(A28^4))/2 -> 41607.5
A29: 28 | B29: 29 | C29: =(B29^4)-(A29^4) -> 92625 | D29: =(B29^4) -> 707281 | E29: =((B29^4)-(A29^4))/100 -> 926.25 | F29: =((B29^4)-(A29^4))/2 -> 46312.5 | G29: =((B29^4)-(A29^4))/2 -> 46312.5
A30: 29 | B30: 30 | C30: =(B30^4)-(A30^4) -> 102719 | D30: =(B30^4) -> 810000 | E30: =((B30^4)-(A30^4))/100 -> 1027.19 | F30: =((B30^4)-(A30^4))/2 -> 51359.5 | G30: =((B30^4)-(A30^4))/2 -> 51359.5
A31: 30 | B31: 31 | C31: =(B31^4)-(A31^4) -> 113521 | D31: =(B31^4) -> 923521 | E31: =((B31^4)-(A31^4))/100 -> 1135.21 | F31: =((B31^4)-(A31^4))/2 -> 56760.5 | G31: =((B31^4)-(A31^4))/2 -> 56760.5
A32: 31 | B32: 32 | C32: =(B32^4)-(A32^4) -> 125055 | D32: =(B32^4) -> 1048576 | E32: =((B32^4)-(A32^4))/100 -> 1250.55 | F32: =((B32^4)-(A32^4))/2 -> 62527.5 | G32: =((B32^4)-(A32^4))/2 -> 62527.5
A33: 32 | B33: 33 | C33: =(B33^4)-(A33^4) -> 137345 | D33: =(B33^4) -> 1185921 | E33: =((B33^4)-(A33^4))/100 -> 1373.45 | F33: =((B33^4)-(A33^4))/2 -> 68672.5 | G33: =((B33^4)-(A33^4))/2 -> 68672.5
A34: 33 | B34: 34 | C34: =(B34^4)-(A34^4) -> 150415 | D34: =(B34^4) -> 1336336 | E34: =((B34^4)-(A34^4))/100 -> 1504.15 | F34: =((B34^4)-(A34^4))/2 -> 75207.5 | G34: =((B34^4)-(A34^4))/2 -> 75207.5
A35: 34 | B35: 35 | C35: =(B35^4)-(A35^4) -> 164289 | D35: =(B35^4) -> 1500625 | E35: =((B35^4)-(A35^4))/100 -> 1642.89 | F35: =((B35^4)-(A35^4))/2 -> 82144.5 | G35: =((B35^4)-(A35^4))/2 -> 82144.5
A36: 35 | B36: 36 | C36: =(B36^4)-(A36^4) -> 178991 | D36: =(B36^4) -> 1679616 | E36: =((B36^4)-(A36^4))/100 -> 1789.91 | F36: =((B36^4)-(A36^4))/2 -> 89495.5 | G36: =((B36^4)-(A36^4))/2 -> 89495.5
A37: 36 | B37: 37 | C37: =(B37^4)-(A37^4) -> 194545 | D37: =(B37^4) -> 1874161 | E37: =((B37^4)-(A37^4))/100 -> 1945.45 | F37: =((B37^4)-(A37^4))/2 -> 97272.5 | G37: =((B37^4)-(A37^4))/2 -> 97272.5
A38: 37 | B38: 38 | C38: =(B38^4)-(A38^4) -> 210975 | D38: =(B38^4) -> 2085136 | E38: =((B38^4)-(A38^4))/100 -> 2109.75 | F38: =((B38^4)-(A38^4))/2 -> 105487.5 | G38: =((B38^4)-(A38^4))/2 -> 105487.5
A39: 38 | B39: 39 | C39: =(B39^4)-(A39^4) -> 228305 | D39: =(B39^4) -> 2313441 | E39: =((B39^4)-(A39^4))/100 -> 2283.05 | F39: =((B39^4)-(A39^4))/2 -> 114152.5 | G39: =((B39^4)-(A39^4))/2 -> 114152.5
A40: 39 | B40: 40 | C40: =(B40^4)-(A40^4) -> 246559 | D40: =(B40^4) -> 2560000 | E40: =((B40^4)-(A40^4))/100 -> 2465.59 | F40: =((B40^4)-(A40^4))/2 -> 123279.5 | G40: =((B40^4)-(A40^4))/2 -> 123279.5
A41: 40 | B41: 41 | C41: =(B41^4)-(A41^4) -> 265761 | D41: =(B41^4) -> 2825761 | E41: =((B41^4)-(A41^4))/100 -> 2657.61 | F41: =((B41^4)-(A41^4))/2 -> 132880.5 | G41: =((B41^4)-(A41^4))/2 -> 132880.5
A42: 41 | B42: 42 | C42: =(B42^4)-(A42^4) -> 285935 | D42: =(B42^4) -> 3111696 | E42: =((B42^4)-(A42^4))/100 -> 2859.35 | F42: =((B42^4)-(A42^4))/2 -> 142967.5 | G42: =((B42^4)-(A42^4))/2 -> 142967.5
A43: 42 | B43: 43 | C43: =(B43^4)-(A43^4) -> 307105 | D43: =(B43^4) -> 3418801 | E43: =((B43^4)-(A43^4))/100 -> 3071.05 | F43: =((B43^4)-(A43^4))/2 -> 153552.5 | G43: =((B43^4)-(A43^4))/2 -> 153552.5
A44: 43 | B44: 44 | C44: =(B44^4)-(A44^4) -> 329295 | D44: =(B44^4) -> 3748096 | E44: =((B44^4)-(A44^4))/100 -> 3292.95 | F44: =((B44^4)-(A44^4))/2 -> 164647.5 | G44: =((B44^4)-(A44^4))/2 -> 164647.5
A45: 44 | B45: 45 | C45: =(B45^4)-(A45^4) -> 352529 | D45: =(B45^4) -> 4100625 | E45: =((B45^4)-(A45^4))/100 -> 3525.29 | F45: =((B45^4)-(A45^4))/2 -> 176264.5 | G45: =((B45^4)-(A45^4))/2 -> 176264.5
A46: 45 | B46: 46 | C46: =(B46^4)-(A46^4) -> 376831 | D46: =(B46^4) -> 4477456 | E46: =((B46^4)-(A46^4))/100 -> 3768.31 | F46: =((B46^4)-(A46^4))/2 -> 188415.5 | G46: =((B46^4)-(A46^4))/2 -> 188415.5
A47: 46 | B47: 47 | C47: =(B47^4)-(A47^4) -> 402225 | D47: =(B47^4) -> 4879681 | E47: =((B47^4)-(A47^4))/100 -> 4022.25 | F47: =((B47^4)-(A47^4))/2 -> 201112.5 | G47: =((B47^4)-(A47^4))/2 -> 201112.5
A48: 47 | B48: 48 | C48: =(B48^4)-(A48^4) -> 428735 | D48: =(B48^4) -> 5308416 | E48: =((B48^4)-(A48^4))/100 -> 4287.35 | F48: =((B48^4)-(A48^4))/2 -> 214367.5 | G48: =((B48^4)-(A48^4))/2 -> 214367.5
A49: 48 | B49: 49 | C49: =(B49^4)-(A49^4) -> 456385 | D49: =(B49^4) -> 5764801 | E49: =((B49^4)-(A49^4))/100 -> 4563.85 | F49: =((B49^4)-(A49^4))/2 -> 228192.5 | G49: =((B49^4)-(A49^4))/2 -> 228192.5
A50: 49 | B50: 50 | C50: =(B50^4)-(A50^4) -> 485199 | D50: =(B50^4) -> 6250000 | E50: =((B50^4)-(A50^4))/100 -> 4851.99 | F50: =((B50^4)-(A50^4))/2 -> 242599.5 | G50: =((B50^4)-(A50^4))/2 -> 242599.5
A51: 50 | B51: 51 | C51: =(B51^4)-(A51^4) -> 515201 | D51: =(B51^4) -> 6765201 | E51: =((B51^4)-(A51^4))/100 -> 5152.01 | F51: =((B51^4)-(A51^4))/2 -> 257600.5 | G51: =((B51^4)-(A51^4))/2 -> 257600.5
A52: 51 | B52: 52 | C52: =(B52^4)-(A52^4) -> 546415 | D52: =(B52^4) -> 7311616 | E52: =((B52^4)-(A52^4))/100 -> 5464.15 | F52: =((B52^4)-(A52^4))/2 -> 273207.5 | G52: =((B52^4)-(A52^4))/2 -> 273207.5
A53: 52 | B53: 53 | C53: =(B53^4)-(A53^4) -> 578865 | D53: =(B53^4) -> 7890481 | E53: =((B53^4)-(A53^4))/100 -> 5788.65 | F53: =((B53^4)-(A53^4))/2 -> 289432.5 | G53: =((B53^4)-(A53^4))/2 -> 289432.5
A54: 53 | B54: 54 | C54: =(B54^4)-(A54^4) -> 612575 | D54: =(B54^4) -> 8503056 | E54: =((B54^4)-(A54^4))/100 -> 6125.75 | F54: =((B54^4)-(A54^4))/2 -> 306287.5 | G54: =((B54^4)-(A54^4))/2 -> 306287.5
A55: 54 | B55: 55 | C55: =(B55^4)-(A55^4) -> 647569 | D55: =(B55^4) -> 9150625 | E55: =((B55^4)-(A55^4))/100 -> 6475.69 | F55: =((B55^4)-(A55^4))/2 -> 323784.5 | G55: =((B55^4)-(A55^4))/2 -> 323784.5
A56: 55 | B56: 56 | C56: =(B56^4)-(A56^4) -> 683871 | D56: =(B56^4) -> 9834496 | E56: =((B56^4)-(A56^4))/100 -> 6838.71 | F56: =((B56^4)-(A56^4))/2 -> 341935.5 | G56: =((B56^4)-(A56^4))/2 -> 341935.5
A57: 56 | B57: 57 | C57: =(B57^4)-(A57^4) -> 721505 | D57: =(B57^4) -> 10556001 | E57: =((B57^4)-(A57^4))/100 -> 7215.05 | F57: =((B57^4)-(A57^4))/2 -> 360752.5 | G57: =((B57^4)-(A57^4))/2 -> 360752.5
A58: 57 | B58: 58 | C58: =(B58^4)-(A58^4) -> 760495 | D58: =(B58^4) -> 11316496 | E58: =((B58^4)-(A58^4))/100 -> 7604.95 | F58: =((B58^4)-(A58^4))/2 -> 380247.5 | G58: =((B58^4)-(A58^4))/2 -> 380247.5
A59: 58 | B59: 59 | C59: =(B59^4)-(A59^4) -> 800865 | D59: =(B59^4) -> 12117361 | E59: =((B59^4)-(A59^4))/100 -> 8008.65 | F59: =((B59^4)-(A59^4))/2 -> 400432.5 | G59: =((B59^4)-(A59^4))/2 -> 400432.5
A60: 59 | B60: 60 | C60: =(B60^4)-(A60^4) -> 842639 | D60: =(B60^4) -> 12960000 | E60: =((B60^4)-(A60^4))/100 -> 8426.39 | F60: =((B60^4)-(A60^4))/2 -> 421319.5 | G60: =((B60^4)-(A60^4))/2 -> 421319.5
A61: 60 | B61: 61 | C61: =(B61^4)-(A61^4) -> 885841 | D61: =(B61^4) -> 13845841 | E61: =((B61^4)-(A61^4))/100 -> 8858.41 | F61: =((B61^4)-(A61^4))/2 -> 442920.5 | G61: =((B61^4)-(A61^4))/2 -> 442920.5
A62: 61 | B62: 62 | C62: =(B62^4)-(A62^4) -> 930495 | D62: =(B62^4) -> 14776336 | E62: =((B62^4)-(A62^4))/100 -> 9304.95 | F62: =((B62^4)-(A62^4))/2 -> 465247.5 | G62: =((B62^4)-(A62^4))/2 -> 465247.5
A63: 62 | B63: 63 | C63: =(B63^4)-(A63^4) -> 976625 | D63: =(B63^4) -> 15752961 | E63: =((B63^4)-(A63^4))/100 -> 9766.25 | F63: =((B63^4)-(A63^4))/2 -> 488312.5 | G63: =((B63^4)-(A63^4))/2 -> 488312.5
A64: 63 | B64: 64 | C64: =(B64^4)-(A64^4) -> 1024255 | D64: =(B64^4) -> 16777216 | E64: =((B64^4)-(A64^4))/100 -> 10242.55 | F64: =((B64^4)-(A64^4))/2 -> 512127.5 | G64: =((B64^4)-(A64^4))/2 -> 512127.5
A65: 64 | B65: 65 | C65: =(B65^4)-(A65^4) -> 1073409 | D65: =(B65^4) -> 17850625 | E65: =((B65^4)-(A65^4))/100 -> 10734.09 | F65: =((B65^4)-(A65^4))/2 -> 536704.5 | G65: =((B65^4)-(A65^4))/2 -> 536704.5
A66: 65 | B66: 66 | C66: =(B66^4)-(A66^4) -> 1124111 | D66: =(B66^4) -> 18974736 | E66: =((B66^4)-(A66^4))/100 -> 11241.11 | F66: =((B66^4)-(A66^4))/2 -> 562055.5 | G66: =((B66^4)-(A66^4))/2 -> 562055.5
A67: 66 | B67: 67 | C67: =(B67^4)-(A67^4) -> 1176385 | D67: =(B67^4) -> 20151121 | E67: =((B67^4)-(A67^4))/100 -> 11763.85 | F67: =((B67^4)-(A67^4))/2 -> 588192.5 | G67: =((B67^4)-(A67^4))/2 -> 588192.5
A68: 67 | B68: 68 | C68: =(B68^4)-(A68^4) -> 1230255 | D68: =(B68^4) -> 21381376 | E68: =((B68^4)-(A68^4))/100 -> 12302.55 | F68: =((B68^4)-(A68^4))/2 -> 615127.5 | G68: =((B68^4)-(A68^4))/2 -> 615127.5
A69: 68 | B69: 69 | C69: =(B69^4)-(A69^4) -> 1285745 | D69: =(B69^4) -> 22667121 | E69: =((B69^4)-(A69^4))/100 -> 12857.45 | F69: =((B69^4)-(A69^4))/2 -> 642872.5 | G69: =((B69^4)-(A69^4))/2 -> 642872.5
A70: 69 | B70: 70 | C70: =(B70^4)-(A70^4) -> 1342879 | D70: =(B70^4) -> 24010000 | E70: =((B70^4)-(A70^4))/100 -> 13428.79 | F70: =((B70^4)-(A70^4))/2 -> 671439.5 | G70: =((B70^4)-(A70^4))/2 -> 671439.5
A71: 70 | B71: 71 | C71: =(B71^4)-(A71^4) -> 1401681 | D71: =(B71^4) -> 25411681 | E71: =((B71^4)-(A71^4))/100 -> 14016.81 | F71: =((B71^4)-(A71^4))/2 -> 700840.5 | G71: =((B71^4)-(A71^4))/2 -> 700840.5
A72: 71 | B72: 72 | C72: =(B72^4)-(A72^4) -> 1462175 | D72: =(B72^4) -> 26873856 | E72: =((B72^4)-(A72^4))/100 -> 14621.75 | F72: =((B72^4)-(A72^4))/2 -> 731087.5 | G72: =((B72^4)-(A72^4))/2 -> 731087.5
A73: 72 | B73: 73 | C73: =(B73^4)-(A73^4) -> 1524385 | D73: =(B73^4) -> 28398241 | E73: =((B73^4)-(A73^4))/100 -> 15243.85 | F73: =((B73^4)-(A73^4))/2 -> 762192.5 | G73: =((B73^4)-(A73^4))/2 -> 762192.5
A74: 73 | B74: 74 | C74: =(B74^4)-(A74^4) -> 1588335 | D74: =(B74^4) -> 29986576 | E74: =((B74^4)-(A74^4))/100 -> 15883.35 | F74: =((B74^4)-(A74^4))/2 -> 794167.5 | G74: =((B74^4)-(A74^4))/2 -> 794167.5
A75: 74 | B75: 75 | C75: =(B75^4)-(A75^4) -> 1654049 | D75: =(B75^4) -> 31640625 | E75: =((B75^4)-(A75^4))/100 -> 16540.49 | F75: =((B75^4)-(A75^4))/2 -> 827024.5 | G75: =((B75^4)-(A75^4))/2 -> 827024.5
A76: 75 | B76: 76 | C76: =(B76^4)-(A76^4) -> 1721551 | D76: =(B76^4) -> 33362176 | E76: =((B76^4)-(A76^4))/100 -> 17215.51 | F76: =((B76^4)-(A76^4))/2 -> 860775.5 | G76: =((B76^4)-(A76^4))/2 -> 860775.5
A77: 76 | B77: 77 | C77: =(B77^4)-(A77^4) -> 1790865 | D77: =(B77^4) -> 35153041 | E77: =((B77^4)-(A77^4))/100 -> 17908.65 | F77: =((B77^4)-(A77^4))/2 -> 895432.5 | G77: =((B77^4)-(A77^4))/2 -> 895432.5
A78: 77 | B78: 78 | C78: =(B78^4)-(A78^4) -> 1862015 | D78: =(B78^4) -> 37015056 | E78: =((B78^4)-(A78^4))/100 -> 18620.15 | F78: =((B78^4)-(A78^4))/2 -> 931007.5 | G78: =((B78^4)-(A78^4))/2 -> 931007.5
A79: 78 | B79: 79 | C79: =(B79^4)-(A79^4) -> 1935025 | D79: =(B79^4) -> 38950081 | E79: =((B79^4)-(A79^4))/100 -> 19350.25 | F79: =((B79^4)-(A79^4))/2 -> 967512.5 | G79: =((B79^4)-(A79^4))/2 -> 967512.5
A80: 79 | B80: 80 | C80: =(B80^4)-(A80^4) -> 2009919 | D80: =(B80^4) -> 40960000 | E80: =((B80^4)-(A80^4))/100 -> 20099.19 | F80: =((B80^4)-(A80^4))/2 -> 1004959.5 | G80: =((B80^4)-(A80^4))/2 -> 1004959.5
A81: 80 | B81: 81 | C81: =(B81^4)-(A81^4) -> 2086721 | D81: =(B81^4) -> 43046721 | E81: =((B81^4)-(A81^4))/100 -> 20867.21 | F81: =((B81^4)-(A81^4))/2 -> 1043360.5 | G81: =((B81^4)-(A81^4))/2 -> 1043360.5
A82: 81 | B82: 82 | C82: =(B82^4)-(A82^4) -> 2165455 | D82: =(B82^4) -> 45212176 | E82: =((B82^4)-(A82^4))/100 -> 21654.55 | F82: =((B82^4)-(A82^4))/2 -> 1082727.5 | G82: =((B82^4)-(A82^4))/2 -> 1082727.5
A83: 82 | B83: 83 | C83: =(B83^4)-(A83^4) -> 2246145 | D83: =(B83^4) -> 47458321 | E83: =((B83^4)-(A83^4))/100 -> 22461.45 | F83: =((B83^4)-(A83^4))/2 -> 1123072.5 | G83: =((B83^4)-(A83^4))/2 -> 1123072.5
A84: 83 | B84: 84 | C84: =(B84^4)-(A84^4) -> 2328815 | D84: =(B84^4) -> 49787136 | E84: =((B84^4)-(A84^4))/100 -> 23288.15 | F84: =((B84^4)-(A84^4))/2 -> 1164407.5 | G84: =((B84^4)-(A84^4))/2 -> 1164407.5
A85: 84 | B85: 85 | C85: =(B85^4)-(A85^4) -> 2413489 | D85: =(B85^4) -> 52200625 | E85: =((B85^4)-(A85^4))/100 -> 24134.89 | F85: =((B85^4)-(A85^4))/2 -> 1206744.5 | G85: =((B85^4)-(A85^4))/2 -> 1206744.5
A86: 85 | B86: 86 | C86: =(B86^4)-(A86^4) -> 2500191 | D86: =(B86^4) -> 54700816 | E86: =((B86^4)-(A86^4))/100 -> 25001.91 | F86: =((B86^4)-(A86^4))/2 -> 1250095.5 | G86: =((B86^4)-(A86^4))/2 -> 1250095.5
A87: 86 | B87: 87 | C87: =(B87^4)-(A87^4) -> 2588945 | D87: =(B87^4) -> 57289761 | E87: =((B87^4)-(A87^4))/100 -> 25889.45 | F87: =((B87^4)-(A87^4))/2 -> 1294472.5 | G87: =((B87^4)-(A87^4))/2 -> 1294472.5
A88: 87 | B88: 88 | C88: =(B88^4)-(A88^4) -> 2679775 | D88: =(B88^4) -> 59969536 | E88: =((B88^4)-(A88^4))/100 -> 26797.75 | F88: =((B88^4)-(A88^4))/2 -> 1339887.5 | G88: =((B88^4)-(A88^4))/2 -> 1339887.5
A89: 88 | B89: 89 | C89: =(B89^4)-(A89^4) -> 2772705 | D89: =(B89^4) -> 62742241 | E89: =((B89^4)-(A89^4))/100 -> 27727.05 | F89: =((B89^4)-(A89^4))/2 -> 1386352.5 | G89: =((B89^4)-(A89^4))/2 -> 1386352.5
A90: 89 | B90: 90 | C90: =(B90^4)-(A90^4) -> 2867759 | D90: =(B90^4) -> 65610000 | E90: =((B90^4)-(A90^4))/100 -> 28677.59 | F90: =((B90^4)-(A90^4))/2 -> 1433879.5 | G90: =((B90^4)-(A90^4))/2 -> 1433879.5
A91: 90 | B91: 91 | C91: =(B91^4)-(A91^4) -> 2964961 | D91: =(B91^4) -> 68574961 | E91: =((B91^4)-(A91^4))/100 -> 29649.61 | F91: =((B91^4)-(A91^4))/2 -> 1482480.5 | G91: =((B91^4)-(A91^4))/2 -> 1482480.5
A92: 91 | B92: 92 | C92: =(B92^4)-(A92^4) -> 3064335 | D92: =(B92^4) -> 71639296 | E92: =((B92^4)-(A92^4))/100 -> 30643.35 | F92: =((B92^4)-(A92^4))/2 -> 1532167.5 | G92: =((B92^4)-(A92^4))/2 -> 1532167.5
A93: 92 | B93: 93 | C93: =(B93^4)-(A93^4) -> 3165905 | D93: =(B93^4) -> 74805201 | E93: =((B93^4)-(A93^4))/100 -> 31659.05 | F93: =((B93^4)-(A93^4))/2 -> 1582952.5 | G93: =((B93^4)-(A93^4))/2 -> 1582952.5
A94: 93 | B94: 94 | C94: =(B94^4)-(A94^4) -> 3269695 | D94: =(B94^4) -> 78074896 | E94: =((B94^4)-(A94^4))/100 -> 32696.95 | F94: =((B94^4)-(A94^4))/2 -> 1634847.5 | G94: =((B94^4)-(A94^4))/2 -> 1634847.5
A95: 94 | B95: 95 | C95: =(B95^4)-(A95^4) -> 3375729 | D95: =(B95^4) -> 81450625 | E95: =((B95^4)-(A95^4))/100 -> 33757.29 | F95: =((B95^4)-(A95^4))/2 -> 1687864.5 | G95: =((B95^4)-(A95^4))/2 -> 1687864.5
A96: 95 | B96: 96 | C96: =(B96^4)-(A96^4) -> 3484031 | D96: =(B96^4) -> 84934656 | E96: =((B96^4)-(A96^4))/100 -> 34840.31 | F96: =((B96^4)-(A96^4))/2 -> 1742015.5 | G96: =((B96^4)-(A96^4))/2 -> 1742015.5
A97: 96 | B97: 97 | C97: =(B97^4)-(A97^4) -> 3594625 | D97: =(B97^4) -> 88529281 | E97: =((B97^4)-(A97^4))/100 -> 35946.25 | F97: =((B97^4)-(A97^4))/2 -> 1797312.5 | G97: =((B97^4)-(A97^4))/2 -> 1797312.5
A98: 97 | B98: 98 | C98: =(B98^4)-(A98^4) -> 3707535 | D98: =(B98^4) -> 92236816 | E98: =((B98^4)-(A98^4))/100 -> 37075.35 | F98: =((B98^4)-(A98^4))/2 -> 1853767.5 | G98: =((B98^4)-(A98^4))/2 -> 1853767.5
A99: 98 | B99: 99 | C99: =(B99^4)-(A99^4) -> 3822785 | D99: =(B99^4) -> 96059601 | E99: =((B99^4)-(A99^4))/100 -> 38227.85 | F99: =((B99^4)-(A99^4))/2 -> 1911392.5 | G99: =((B99^4)-(A99^4))/2 -> 1911392.5
A100: 99 | B100: 100 | C100: =(B100^4)-(A100^4) -> 3940399 | D100: =(B100^4) -> 100000000 | E100: =((B100^4)-(A100^4))/100 -> 39403.99 | F100: =((B100^4)-(A100^4))/2 -> 1970199.5 | G100: =((B100^4)-(A100^4))/2 -> 1970199.5
A101: 100 | B101: 101 | C101: =(B101^4)-(A101^4) -> 4060401 | D101: =(B101^4) -> 104060401 | E101: =((B101^4)-(A101^4))/100 -> 40604.01 | F101: =((B101^4)-(A101^4))/2 -> 2030200.5 | G101: =((B101^4)-(A101^4))/2 -> 2030200.5
A102: 101 | B102: 102 | C102: =(B102^4)-(A102^4) -> 4182815 | D102: =(B102^4) -> 108243216 | E102: =((B102^4)-(A102^4))/100 -> 41828.15 | F102: =((B102^4)-(A102^4))/2 -> 2091407.5 | G102: =((B102^4)-(A102^4))/2 -> 2091407.5
A103: 102 | B103: 103 | C103: =(B103^4)-(A103^4) -> 4307665 | D103: =(B103^4) -> 112550881 | E103: =((B103^4)-(A103^4))/100 -> 43076.65 | F103: =((B103^4)-(A103^4))/2 -> 2153832.5 | G103: =((B103^4)-(A103^4))/2 -> 2153832.5
A104: 103 | B104: 104 | C104: =(B104^4)-(A104^4) -> 4434975 | D104: =(B104^4) -> 116985856 | E104: =((B104^4)-(A104^4))/100 -> 44349.75 | F104: =((B104^4)-(A104^4))/2 -> 2217487.5 | G104: =((B104^4)-(A104^4))/2 -> 2217487.5
A105: 104 | B105: 105 | C105: =(B105^4)-(A105^4) -> 4564769 | D105: =(B105^4) -> 121550625 | E105: =((B105^4)-(A105^4))/100 -> 45647.69 | F105: =((B105^4)-(A105^4))/2 -> 2282384.5 | G105: =((B105^4)-(A105^4))/2 -> 2282384.5
A106: 105 | B106: 106 | C106: =(B106^4)-(A106^4) -> 4697071 | D106: =(B106^4) -> 126247696 | E106: =((B106^4)-(A106^4))/100 -> 46970.71 | F106: =((B106^4)-(A106^4))/2 -> 2348535.5 | G106: =((B106^4)-(A106^4))/2 -> 2348535.5
A107: 106 | B107: 107 | C107: =(B107^4)-(A107^4) -> 4831905 | D107: =(B107^4) -> 131079601 | E107: =((B107^4)-(A107^4))/100 -> 48319.05 | F107: =((B107^4)-(A107^4))/2 -> 2415952.5 | G107: =((B107^4)-(A107^4))/2 -> 2415952.5
A108: 107 | B108: 108 | C108: =(B108^4)-(A108^4) -> 4969295 | D108: =(B108^4) -> 136048896 | E108: =((B108^4)-(A108^4))/100 -> 49692.95 | F108: =((B108^4)-(A108^4))/2 -> 2484647.5 | G108: =((B108^4)-(A108^4))/2 -> 2484647.5
A109: 108 | B109: 109 | C109: =(B109^4)-(A109^4) -> 5109265 | D109: =(B109^4) -> 141158161 | E109: =((B109^4)-(A109^4))/100 -> 51092.65 | F109: =((B109^4)-(A109^4))/2 -> 2554632.5 | G109: =((B109^4)-(A109^4))/2 -> 2554632.5
A110: 109 | B110: 110 | C110: =(B110^4)-(A110^4) -> 5251839 | D110: =(B110^4) -> 146410000 | E110: =((B110^4)-(A110^4))/100 -> 52518.39 | F110: =((B110^4)-(A110^4))/2 -> 2625919.5 | G110: =((B110^4)-(A110^4))/2 -> 2625919.5
A111: 110 | B111: 111 | C111: =(B111^4)-(A111^4) -> 5397041 | D111: =(B111^4) -> 151807041 | E111: =((B111^4)-(A111^4))/100 -> 53970.41 | F111: =((B111^4)-(A111^4))/2 -> 2698520.5 | G111: =((B111^4)-(A111^4))/2 -> 2698520.5
A112: 111 | B112: 112 | C112: =(B112^4)-(A112^4) -> 5544895 | D112: =(B112^4) -> 157351936 | E112: =(B112^4) -> 157351936 | F112: =((B112^4)-(A112^4))/2 -> 2772447.5 | G112: =((B112^4)-(A112^4))/2 -> 2772447.5
A113: 112 | B113: 113 | C113: =(B113^4)-(A113^4) -> 5695425 | D113: =(B113^4) -> 163047361 | E113: =(B113^4) -> 163047361 | F113: =((B113^4)-(A113^4))/2 -> 2847712.5 | G113: =((B113^4)-(A113^4))/2 -> 2847712.5
A114: 113 | B114: 114 | C114: =(B114^4)-(A114^4) -> 5848655 | D114: =(B114^4) -> 168896016 | E114: =(B114^4) -> 168896016 | F114: =((B114^4)-(A114^4))/2 -> 2924327.5 | G114: =((B114^4)-(A114^4))/2 -> 2924327.5
A115: 114 | B115: 115 | C115: =(B115^4)-(A115^4) -> 6004609 | D115: =(B115^4) -> 174900625 | E115: =(B115^4) -> 174900625 | F115: =((B115^4)-(A115^4))/2 -> 3002304.5 | G115: =((B115^4)-(A115^4))/2 -> 3002304.5
A116: 115 | B116: 116 | C116: =(B116^4)-(A116^4) -> 6163311 | D116: =(B116^4) -> 181063936 | E116: =(B116^4) -> 181063936 | F116: =((B116^4)-(A116^4))/2 -> 3081655.5 | G116: =((B116^4)-(A116^4))/2 -> 3081655.5
A117: 116 | B117: 117 | C117: =(B117^4)-(A117^4) -> 6324785 | D117: =(B117^4) -> 187388721 | E117: =(B117^4) -> 187388721 | F117: =((B117^4)-(A117^4))/2 -> 3162392.5 | G117: =((B117^4)-(A117^4))/2 -> 3162392.5
A118: 117 | B118: 118 | C118: =(B118^4)-(A118^4) -> 6489055 | D118: =(B118^4) -> 193877776 | E118: =(B118^4) -> 193877776 | F118: =((B118^4)-(A118^4))/2 -> 3244527.5 | G118: =((B118^4)-(A118^4))/2 -> 3244527.5
A119: 118 | B119: 119 | C119: =(B119^4)-(A119^4) -> 6656145 | D119: =(B119^4) -> 200533921 | E119: =(B119^4) -> 200533921 | F119: =((B119^4)-(A119^4))/2 -> 3328072.5 | G119: =((B119^4)-(A119^4))/2 -> 3328072.5
A120: 119 | B120: 120 | C120: =(B120^4)-(A120^4) -> 6826079 | D120: =(B120^4) -> 207360000 | E120: =((B120^4)-(A120^4))/100 -> 68260.79 | F120: =((B120^4)-(A120^4))/2 -> 3413039.5 | G120: =((B120^4)-(A120^4))/2 -> 3413039.5
A121: 120 | B121: 121 | C121: =(B121^4)-(A121^4) -> 6998881 | D121: =(B121^4) -> 214358881 | E121: =(B121^4) -> 214358881 | F121: =((B121^4)-(A121^4))/2 -> 3499440.5 | G121: =((B121^4)-(A121^4))/2 -> 3499440.5
A122: 121 | B122: 122 | C122: =(B122^4)-(A122^4) -> 7174575 | D122: =(B122^4) -> 221533456 | E122: =(B122^4) -> 221533456 | F122: =((B122^4)-(A122^4))/2 -> 3587287.5 | G122: =((B122^4)-(A122^4))/2 -> 3587287.5
A123: 122 | B123: 123 | C123: =(B123^4)-(A123^4) -> 7353185 | D123: =(B123^4) -> 228886641 | E123: =(B123^4) -> 228886641 | F123: =((B123^4)-(A123^4))/2 -> 3676592.5 | G123: =((B123^4)-(A123^4))/2 -> 3676592.5
A124: 123 | B124: 124 | C124: =(B124^4)-(A124^4) -> 7534735 | D124: =(B124^4) -> 236421376 | E124: =(B124^4) -> 236421376 | F124: =((B124^4)-(A124^4))/2 -> 3767367.5 | G124: =((B124^4)-(A124^4))/2 -> 3767367.5
A125: 124 | B125: 125 | C125: =(B125^4)-(A125^4) -> 7719249 | D125: =(B125^4) -> 244140625 | E125: =(B125^4) -> 244140625 | F125: =((B125^4)-(A125^4))/2 -> 3859624.5 | G125: =((B125^4)-(A125^4))/2 -> 3859624.5
A126: 125 | B126: 126 | C126: =(B126^4)-(A126^4) -> 7906751 | D126: =(B126^4) -> 252047376 | E126: =(B126^4) -> 252047376 | F126: =((B126^4)-(A126^4))/2 -> 3953375.5 | G126: =((B126^4)-(A126^4))/2 -> 3953375.5
A127: 126 | B127: 127 | C127: =(B127^4)-(A127^4) -> 8097265 | D127: =(B127^4) -> 260144641 | E127: =(B127^4) -> 260144641 | F127: =((B127^4)-(A127^4))/2 -> 4048632.5 | G127: =((B127^4)-(A127^4))/2 -> 4048632.5
A128: 127 | B128: 128 | C128: =(B128^4)-(A128^4) -> 8290815 | D128: =(B128^4) -> 268435456 | E128: =(B128^4) -> 268435456 | F128: =((B128^4)-(A128^4))/2 -> 4145407.5 | G128: =((B128^4)-(A128^4))/2 -> 4145407.5
A129: 128 | B129: 129 | C129: =(B129^4)-(A129^4) -> 8487425 | D129: =(B129^4) -> 276922881 | E129: =(B129^4) -> 276922881 | F129: =((B129^4)-(A129^4))/2 -> 4243712.5 | G129: =((B129^4)-(A129^4))/2 -> 4243712.5
A130: 129 | B130: 130 | C130: =(B130^4)-(A130^4) -> 8687119 | D130: =(B130^4) -> 285610000 | E130: =((B130^4)-(A130^4))/100 -> 86871.19 | F130: =((B130^4)-(A130^4))/2 -> 4343559.5 | G130: =((B130^4)-(A130^4))/2 -> 4343559.5
A131: 130 | B131: 131 | C131: =(B131^4)-(A131^4) -> 8889921 | D131: =(B131^4) -> 294499921 | E131: =(B131^4) -> 294499921 | F131: =((B131^4)-(A131^4))/2 -> 4444960.5 | G131: =((B131^4)-(A131^4))/2 -> 4444960.5
A132: 131 | B132: 132 | C132: =(B132^4)-(A132^4) -> 9095855 | D132: =(B132^4) -> 303595776 | E132: =(B132^4) -> 303595776 | F132: =((B132^4)-(A132^4))/2 -> 4547927.5 | G132: =((B132^4)-(A132^4))/2 -> 4547927.5
A133: 132 | B133: 133 | C133: =(B133^4)-(A133^4) -> 9304945 | D133: =(B133^4) -> 312900721 | E133: =(B133^4) -> 312900721 | F133: =((B133^4)-(A133^4))/2 -> 4652472.5 | G133: =((B133^4)-(A133^4))/2 -> 4652472.5
A134: 133 | B134: 134 | C134: =(B134^4)-(A134^4) -> 9517215 | D134: =(B134^4) -> 322417936 | E134: =(B134^4) -> 322417936 | F134: =((B134^4)-(A134^4))/2 -> 4758607.5 | G134: =((B134^4)-(A134^4))/2 -> 4758607.5
A135: 134 | B135: 135 | C135: =(B135^4)-(A135^4) -> 9732689 | D135: =(B135^4) -> 332150625 | E135: =(B135^4) -> 332150625 | F135: =((B135^4)-(A135^4))/2 -> 4866344.5 | G135: =((B135^4)-(A135^4))/2 -> 4866344.5
A136: 135 | B136: 136 | C136: =(B136^4)-(A136^4) -> 9951391 | D136: =(B136^4) -> 342102016 | E136: =(B136^4) -> 342102016 | F136: =((B136^4)-(A136^4))/2 -> 4975695.5 | G136: =((B136^4)-(A136^4))/2 -> 4975695.5
A137: 136 | B137: 137 | C137: =(B137^4)-(A137^4) -> 10173345 | D137: =(B137^4) -> 352275361 | E137: =(B137^4) -> 352275361 | F137: =((B137^4)-(A137^4))/2 -> 5086672.5 | G137: =((B137^4)-(A137^4))/2 -> 5086672.5
A138: 137 | B138: 138 | C138: =(B138^4)-(A138^4) -> 10398575 | D138: =(B138^4) -> 362673936 | E138: =(B138^4) -> 362673936 | F138: =((B138^4)-(A138^4))/2 -> 5199287.5 | G138: =((B138^4)-(A138^4))/2 -> 5199287.5
A139: 138 | B139: 139 | C139: =(B139^4)-(A139^4) -> 10627105 | D139: =(B139^4) -> 373301041 | E139: =(B139^4) -> 373301041 | F139: =((B139^4)-(A139^4))/2 -> 5313552.5 | G139: =((B139^4)-(A139^4))/2 -> 5313552.5
A140: 139 | B140: 140 | C140: =(B140^4)-(A140^4) -> 10858959 | D140: =(B140^4) -> 384160000 | E140: =((B140^4)-(A140^4))/100 -> 108589.59 | F140: =((B140^4)-(A140^4))/2 -> 5429479.5 | G140: =((B140^4)-(A140^4))/2 -> 5429479.5
A141: 140 | B141: 141 | C141: =(B141^4)-(A141^4) -> 11094161 | D141: =(B141^4) -> 395254161 | E141: =(B141^4) -> 395254161 | F141: =((B141^4)-(A141^4))/2 -> 5547080.5 | G141: =((B141^4)-(A141^4))/2 -> 5547080.5
A142: 141 | B142: 142 | C142: =(B142^4)-(A142^4) -> 11332735 | D142: =(B142^4) -> 406586896 | E142: =(B142^4) -> 406586896 | F142: =((B142^4)-(A142^4))/2 -> 5666367.5 | G142: =((B142^4)-(A142^4))/2 -> 5666367.5
A143: 142 | B143: 143 | C143: =(B143^4)-(A143^4) -> 11574705 | D143: =(B143^4) -> 418161601 | E143: =(B143^4) -> 418161601 | F143: =((B143^4)-(A143^4))/2 -> 5787352.5 | G143: =((B143^4)-(A143^4))/2 -> 5787352.5
A144: 143 | B144: 144 | C144: =(B144^4)-(A144^4) -> 11820095 | D144: =(B144^4) -> 429981696 | E144: =(B144^4) -> 429981696 | F144: =((B144^4)-(A144^4))/2 -> 5910047.5 | G144: =((B144^4)-(A144^4))/2 -> 5910047.5
A145: 144 | B145: 145 | C145: =(B145^4)-(A145^4) -> 12068929 | D145: =(B145^4) -> 442050625 | E145: =(B145^4) -> 442050625 | F145: =((B145^4)-(A145^4))/2 -> 6034464.5 | G145: =((B145^4)-(A145^4))/2 -> 6034464.5
A146: 145 | B146: 146 | C146: =(B146^4)-(A146^4) -> 12321231 | D146: =(B146^4) -> 454371856 | E146: =(B146^4) -> 454371856 | F146: =((B146^4)-(A146^4))/2 -> 6160615.5 | G146: =((B146^4)-(A146^4))/2 -> 6160615.5
A147: 146 | B147: 147 | C147: =(B147^4)-(A147^4) -> 12577025 | D147: =(B147^4) -> 466948881 | E147: =(B147^4) -> 466948881 | F147: =((B147^4)-(A147^4))/2 -> 6288512.5 | G147: =((B147^4)-(A147^4))/2 -> 6288512.5
A148: 147 | B148: 148 | C148: =(B148^4)-(A148^4) -> 12836335 | D148: =(B148^4) -> 479785216 | E148: =(B148^4) -> 479785216 | F148: =((B148^4)-(A148^4))/2 -> 6418167.5 | G148: =((B148^4)-(A148^4))/2 -> 6418167.5
A149: 148 | B149: 149 | C149: =(B149^4)-(A149^4) -> 13099185 | D149: =(B149^4) -> 492884401 | E149: =(B149^4) -> 492884401 | F149: =((B149^4)-(A149^4))/2 -> 6549592.5 | G149: =((B149^4)-(A149^4))/2 -> 6549592.5
A150: 149 | B150: 150 | C150: =(B150^4)-(A150^4) -> 13365599 | D150: =(B150^4) -> 506250000 | E150: =((B150^4)-(A150^4))/100 -> 133655.99 | F150: =((B150^4)-(A150^4))/2 -> 6682799.5 | G150: =((B150^4)-(A150^4))/2 -> 6682799.5
A151: 150 | B151: 151 | C151: =(B151^4)-(A151^4) -> 13635601 | D151: =(B151^4) -> 519885601 | E151: =(B151^4) -> 519885601 | F151: =((B151^4)-(A151^4))/2 -> 6817800.5 | G151: =((B151^4)-(A151^4))/2 -> 6817800.5
A152: 151 | B152: 152 | C152: =(B152^4)-(A152^4) -> 13909215 | D152: =(B152^4) -> 533794816 | E152: =(B152^4) -> 533794816 | F152: =((B152^4)-(A152^4))/2 -> 6954607.5 | G152: =((B152^4)-(A152^4))/2 -> 6954607.5
A153: 152 | B153: 153 | C153: =(B153^4)-(A153^4) -> 14186465 | D153: =(B153^4) -> 547981281 | E153: =(B153^4) -> 547981281 | F153: =((B153^4)-(A153^4))/2 -> 7093232.5 | G153: =((B153^4)-(A153^4))/2 -> 7093232.5
A154: 153 | B154: 154 | C154: =(B154^4)-(A154^4) -> 14467375 | D154: =(B154^4) -> 562448656 | E154: =(B154^4) -> 562448656 | F154: =((B154^4)-(A154^4))/2 -> 7233687.5 | G154: =((B154^4)-(A154^4))/2 -> 7233687.5
A155: 154 | B155: 155 | C155: =(B155^4)-(A155^4) -> 14751969 | D155: =(B155^4) -> 577200625 | E155: =(B155^4) -> 577200625 | F155: =((B155^4)-(A155^4))/2 -> 7375984.5 | G155: =((B155^4)-(A155^4))/2 -> 7375984.5
A156: 155 | B156: 156 | C156: =(B156^4)-(A156^4) -> 15040271 | D156: =(B156^4) -> 592240896 | E156: =(B156^4) -> 592240896 | F156: =((B156^4)-(A156^4))/2 -> 7520135.5 | G156: =((B156^4)-(A156^4))/2 -> 7520135.5
A157: 156 | B157: 157 | C157: =(B157^4)-(A157^4) -> 15332305 | D157: =(B157^4) -> 607573201 | E157: =(B157^4) -> 607573201 | F157: =((B157^4)-(A157^4))/2 -> 7666152.5 | G157: =((B157^4)-(A157^4))/2 -> 7666152.5
A158: 157 | B158: 158 | C158: =(B158^4)-(A158^4) -> 15628095 | D158: =(B158^4) -> 623201296 | E158: =(B158^4) -> 623201296 | F158: =((B158^4)-(A158^4))/2 -> 7814047.5 | G158: =((B158^4)-(A158^4))/2 -> 7814047.5
A159: 158 | B159: 159 | C159: =(B159^4)-(A159^4) -> 15927665 | D159: =(B159^4) -> 639128961 | E159: =(B159^4) -> 639128961 | F159: =((B159^4)-(A159^4))/2 -> 7963832.5 | G159: =((B159^4)-(A159^4))/2 -> 7963832.5
A160: 159 | B160: 160 | C160: =(B160^4)-(A160^4) -> 16231039 | D160: =(B160^4) -> 655360000 | E160: =((B160^4)-(A160^4))/100 -> 162310.39 | F160: =((B160^4)-(A160^4))/2 -> 8115519.5 | G160: =((B160^4)-(A160^4))/2 -> 8115519.5
A161: 160 | B161: 161 | C161: =(B161^4)-(A161^4) -> 16538241 | D161: =(B161^4) -> 671898241 | E161: =(B161^4) -> 671898241 | F161: =((B161^4)-(A161^4))/2 -> 8269120.5 | G161: =((B161^4)-(A161^4))/2 -> 8269120.5
A162: 161 | B162: 162 | C162: =(B162^4)-(A162^4) -> 16849295 | D162: =(B162^4) -> 688747536 | E162: =(B162^4) -> 688747536 | F162: =((B162^4)-(A162^4))/2 -> 8424647.5 | G162: =((B162^4)-(A162^4))/2 -> 8424647.5
A163: 162 | B163: 163 | C163: =(B163^4)-(A163^4) -> 17164225 | D163: =(B163^4) -> 705911761 | E163: =(B163^4) -> 705911761 | F163: =((B163^4)-(A163^4))/2 -> 8582112.5 | G163: =((B163^4)-(A163^4))/2 -> 8582112.5
A164: 163 | B164: 164 | C164: =(B164^4)-(A164^4) -> 17483055 | D164: =(B164^4) -> 723394816 | E164: =(B164^4) -> 723394816 | F164: =((B164^4)-(A164^4))/2 -> 8741527.5 | G164: =((B164^4)-(A164^4))/2 -> 8741527.5
A165: 164 | B165: 165 | C165: =(B165^4)-(A165^4) -> 17805809 | D165: =(B165^4) -> 741200625 | E165: =(B165^4) -> 741200625 | F165: =((B165^4)-(A165^4))/2 -> 8902904.5 | G165: =((B165^4)-(A165^4))/2 -> 8902904.5
A166: 165 | B166: 166 | C166: =(B166^4)-(A166^4) -> 18132511 | D166: =(B166^4) -> 759333136 | E166: =(B166^4) -> 759333136 | F166: =((B166^4)-(A166^4))/2 -> 9066255.5 | G166: =((B166^4)-(A166^4))/2 -> 9066255.5
A167: 166 | B167: 167 | C167: =(B167^4)-(A167^4) -> 18463185 | D167: =(B167^4) -> 777796321 | E167: =(B167^4) -> 777796321 | F167: =((B167^4)-(A167^4))/2 -> 9231592.5 | G167: =((B167^4)-(A167^4))/2 -> 9231592.5
A168: 167 | B168: 168 | C168: =(B168^4)-(A168^4) -> 18797855 | D168: =(B168^4) -> 796594176 | E168: =(B168^4) -> 796594176 | F168: =((B168^4)-(A168^4))/2 -> 9398927.5 | G168: =((B168^4)-(A168^4))/2 -> 9398927.5
A169: 168 | B169: 169 | C169: =(B169^4)-(A169^4) -> 19136545 | D169: =(B169^4) -> 815730721 | E169: =(B169^4) -> 815730721 | F169: =((B169^4)-(A169^4))/2 -> 9568272.5 | G169: =((B169^4)-(A169^4))/2 -> 9568272.5
A170: 169 | B170: 170 | C170: =(B170^4)-(A170^4) -> 19479279 | D170: =(B170^4) -> 835210000 | E170: =((B170^4)-(A170^4))/100 -> 194792.79 | F170: =((B170^4)-(A170^4))/2 -> 9739639.5 | G170: =((B170^4)-(A170^4))/2 -> 9739639.5
A171: 170 | B171: 171 | C171: =(B171^4)-(A171^4) -> 19826081 | D171: =(B171^4) -> 855036081 | E171: =((B171^4)-(A171^4))/100 -> 198260.81 | F171: =((B171^4)-(A171^4))/2 -> 9913040.5 | G171: =((B171^4)-(A171^4))/2 -> 9913040.5
A172: 171 | B172: 172 | C172: =(B172^4)-(A172^4) -> 20176975 | D172: =(B172^4) -> 875213056 | E172: =((B172^4)-(A172^4))/100 -> 201769.75 | F172: =((B172^4)-(A172^4))/2 -> 10088487.5 | G172: =((B172^4)-(A172^4))/2 -> 10088487.5
A173: 172 | B173: 173 | C173: =(B173^4)-(A173^4) -> 20531985 | D173: =(B173^4) -> 895745041 | E173: =((B173^4)-(A173^4))/100 -> 205319.85 | F173: =((B173^4)-(A173^4))/2 -> 10265992.5 | G173: =((B173^4)-(A173^4))/2 -> 10265992.5
A174: 173 | B174: 174 | C174: =(B174^4)-(A174^4) -> 20891135 | D174: =(B174^4) -> 916636176 | E174: =((B174^4)-(A174^4))/100 -> 208911.35 | F174: =((B174^4)-(A174^4))/2 -> 10445567.5 | G174: =((B174^4)-(A174^4))/2 -> 10445567.5
A175: 174 | B175: 175 | C175: =(B175^4)-(A175^4) -> 21254449 | D175: =(B175^4) -> 937890625 | E175: =((B175^4)-(A175^4))/100 -> 212544.49 | F175: =((B175^4)-(A175^4))/2 -> 10627224.5 | G175: =((B175^4)-(A175^4))/2 -> 10627224.5
A176: 175 | B176: 176 | C176: =(B176^4)-(A176^4) -> 21621951 | D176: =(B176^4) -> 959512576 | E176: =((B176^4)-(A176^4))/100 -> 216219.51 | F176: =((B176^4)-(A176^4))/2 -> 10810975.5 | G176: =((B176^4)-(A176^4))/2 -> 10810975.5
A177: 176 | B177: 177 | C177: =(B177^4)-(A177^4) -> 21993665 | D177: =(B177^4) -> 981506241 | E177: =((B177^4)-(A177^4))/100 -> 219936.65 | F177: =((B177^4)-(A177^4))/2 -> 10996832.5 | G177: =((B177^4)-(A177^4))/2 -> 10996832.5
A178: 177 | B178: 178 | C178: =(B178^4)-(A178^4) -> 22369615 | D178: =(B178^4) -> 1003875856 | E178: =((B178^4)-(A178^4))/100 -> 223696.15 | F178: =((B178^4)-(A178^4))/2 -> 11184807.5 | G178: =((B178^4)-(A178^4))/2 -> 11184807.5
A179: 178 | B179: 179 | C179: =(B179^4)-(A179^4) -> 22749825 | D179: =(B179^4) -> 1026625681 | E179: =((B179^4)-(A179^4))/100 -> 227498.25 | F179: =((B179^4)-(A179^4))/2 -> 11374912.5 | G179: =((B179^4)-(A179^4))/2 -> 11374912.5
A180: 179 | B180: 180 | C180: =(B180^4)-(A180^4) -> 23134319 | D180: =(B180^4) -> 1049760000 | E180: =((B180^4)-(A180^4))/100 -> 231343.19 | F180: =((B180^4)-(A180^4))/2 -> 11567159.5 | G180: =((B180^4)-(A180^4))/2 -> 11567159.5
A181: 180 | B181: 181 | C181: =(B181^4)-(A181^4) -> 23523121 | D181: =(B181^4) -> 1073283121 | E181: =((B181^4)-(A181^4))/100 -> 235231.21 | F181: =((B181^4)-(A181^4))/2 -> 11761560.5 | G181: =((B181^4)-(A181^4))/2 -> 11761560.5
A182: 181 | B182: 182 | C182: =(B182^4)-(A182^4) -> 23916255 | D182: =(B182^4) -> 1097199376 | E182: =((B182^4)-(A182^4))/100 -> 239162.55 | F182: =((B182^4)-(A182^4))/2 -> 11958127.5 | G182: =((B182^4)-(A182^4))/2 -> 11958127.5
A183: 182 | B183: 183 | C183: =(B183^4)-(A183^4) -> 24313745 | D183: =(B183^4) -> 1121513121 | E183: =((B183^4)-(A183^4))/100 -> 243137.45 | F183: =((B183^4)-(A183^4))/2 -> 12156872.5 | G183: =((B183^4)-(A183^4))/2 -> 12156872.5
A184: 183 | B184: 184 | C184: =(B184^4)-(A184^4) -> 24715615 | D184: =(B184^4) -> 1146228736 | E184: =((B184^4)-(A184^4))/100 -> 247156.15 | F184: =((B184^4)-(A184^4))/2 -> 12357807.5 | G184: =((B184^4)-(A184^4))/2 -> 12357807.5
A185: 184 | B185: 185 | C185: =(B185^4)-(A185^4) -> 25121889 | D185: =(B185^4) -> 1171350625 | E185: =((B185^4)-(A185^4))/100 -> 251218.89 | F185: =((B185^4)-(A185^4))/2 -> 12560944.5 | G185: =((B185^4)-(A185^4))/2 -> 12560944.5
A186: 185 | B186: 186 | C186: =(B186^4)-(A186^4) -> 25532591 | D186: =(B186^4) -> 1196883216 | E186: =((B186^4)-(A186^4))/100 -> 255325.91 | F186: =((B186^4)-(A186^4))/2 -> 12766295.5 | G186: =((B186^4)-(A186^4))/2 -> 12766295.5
A187: 186 | B187: 187 | C187: =(B187^4)-(A187^4) -> 25947745 | D187: =(B187^4) -> 1222830961 | E187: =((B187^4)-(A187^4))/100 -> 259477.45 | F187: =((B187^4)-(A187^4))/2 -> 12973872.5 | G187: =((B187^4)-(A187^4))/2 -> 12973872.5
A188: 187 | B188: 188 | C188: =(B188^4)-(A188^4) -> 26367375 | D188: =(B188^4) -> 1249198336 | E188: =((B188^4)-(A188^4))/100 -> 263673.75 | F188: =((B188^4)-(A188^4))/2 -> 13183687.5 | G188: =((B188^4)-(A188^4))/2 -> 13183687.5
A189: 188 | B189: 189 | C189: =(B189^4)-(A189^4) -> 26791505 | D189: =(B189^4) -> 1275989841 | E189: =((B189^4)-(A189^4))/100 -> 267915.05 | F189: =((B189^4)-(A189^4))/2 -> 13395752.5 | G189: =((B189^4)-(A189^4))/2 -> 13395752.5
A190: 189 | B190: 190 | C190: =(B190^4)-(A190^4) -> 27220159 | D190: =(B190^4) -> 1303210000 | E190: =((B190^4)-(A190^4))/100 -> 272201.59 | F190: =((B190^4)-(A190^4))/2 -> 13610079.5 | G190: =((B190^4)-(A190^4))/2 -> 13610079.5
A191: 190 | B191: 191 | C191: =(B191^4)-(A191^4) -> 27653361 | D191: =(B191^4) -> 1330863361 | E191: =((B191^4)-(A191^4))/100 -> 276533.61 | F191: =((B191^4)-(A191^4))/2 -> 13826680.5 | G191: =((B191^4)-(A191^4))/2 -> 13826680.5
A192: 191 | B192: 192 | C192: =(B192^4)-(A192^4) -> 28091135 | D192: =(B192^4) -> 1358954496 | E192: =((B192^4)-(A192^4))/100 -> 280911.35 | F192: =((B192^4)-(A192^4))/2 -> 14045567.5 | G192: =((B192^4)-(A192^4))/2 -> 14045567.5
A193: 192 | B193: 193 | C193: =(B193^4)-(A193^4) -> 28533505 | D193: =(B193^4) -> 1387488001 | E193: =((B193^4)-(A193^4))/100 -> 285335.05 | F193: =((B193^4)-(A193^4))/2 -> 14266752.5 | G193: =((B193^4)-(A193^4))/2 -> 14266752.5
A194: 193 | B194: 194 | C194: =(B194^4)-(A194^4) -> 28980495 | D194: =(B194^4) -> 1416468496 | E194: =((B194^4)-(A194^4))/100 -> 289804.95 | F194: =((B194^4)-(A194^4))/2 -> 14490247.5 | G194: =((B194^4)-(A194^4))/2 -> 14490247.5
A195: 194 | B195: 195 | C195: =(B195^4)-(A195^4) -> 29432129 | D195: =(B195^4) -> 1445900625 | E195: =((B195^4)-(A195^4))/100 -> 294321.29 | F195: =((B195^4)-(A195^4))/2 -> 14716064.5 | G195: =((B195^4)-(A195^4))/2 -> 14716064.5
A196: 195 | B196: 196 | C196: =(B196^4)-(A196^4) -> 29888431 | D196: =(B196^4) -> 1475789056 | E196: =((B196^4)-(A196^4))/100 -> 298884.31 | F196: =((B196^4)-(A196^4))/2 -> 14944215.5 | G196: =((B196^4)-(A196^4))/2 -> 14944215.5
A197: 196 | B197: 197 | C197: =(B197^4)-(A197^4) -> 30349425 | D197: =(B197^4) -> 1506138481 | E197: =((B197^4)-(A197^4))/100 -> 303494.25 | F197: =((B197^4)-(A197^4))/2 -> 15174712.5 | G197: =((B197^4)-(A197^4))/2 -> 15174712.5
A198: 197 | B198: 198 | C198: =(B198^4)-(A198^4) -> 30815135 | D198: =(B198^4) -> 1536953616 | E198: =((B198^4)-(A198^4))/100 -> 308151.35 | F198: =((B198^4)-(A198^4))/2 -> 15407567.5 | G198: =((B198^4)-(A198^4))/2 -> 15407567.5
A199: 198 | B199: 199 | C199: =(B199^4)-(A199^4) -> 31285585 | D199: =(B199^4) -> 1568239201 | E199: =((B199^4)-(A199^4))/100 -> 312855.85 | F199: =((B199^4)-(A199^4))/2 -> 15642792.5 | G199: =((B199^4)-(A199^4))/2 -> 15642792.5
A200: 199 | B200: 200 | C200: =(B200^4)-(A200^4) -> 31760799 | D200: =(B200^4) -> 1600000000 | E200: =((B200^4)-(A200^4))/100 -> 317607.99 | F200: =((B200^4)-(A200^4))/2 -> 15880399.5 | G200: =((B200^4)-(A200^4))/2 -> 15880399.5
A201: Curious Note; the total exp at lvl 200 is a multiple of 16,32,64,128,256,512,and 1024 (1024*15625)